{
  "artifact_policy": {
    "allowed_markdown_exceptions": [
      "operator_created_notes",
      "operator_created_research",
      "operator_created_audits",
      "explicit_on_demand_projection",
      "explicit_report_projection_contract",
      "frozen_legacy_migration_reference"
    ],
    "authority_surface": "MACHINE_CONTRACT",
    "legacy_markdown_policy": "SAFETY_NET_ONLY_DO_NOT_COPY_FORWARD",
    "model_created_markdown_authority_allowed": false,
    "operator_facing_authority": false,
    "projection_creation": "ON_DEMAND_OR_CONTRACT_BOUND"
  },
  "authority_files": {
    "microtask_contract": ".GOV/task_packets/WP-KERNEL-002-CRDT-Workspace-Write-Box-Preuse-Hardening-v1/MT-047.json",
    "microtask_projection": ".GOV/task_packets/WP-KERNEL-002-CRDT-Workspace-Write-Box-Preuse-Hardening-v1/MT-047.md",
    "packet_contract": ".GOV/task_packets/WP-KERNEL-002-CRDT-Workspace-Write-Box-Preuse-Hardening-v1/packet.json"
  },
  "contract_authority": "PRIMARY_MACHINE_READABLE",
  "created_at_utc": "2026-05-14T04:54:49.177Z",
  "handoff": {
    "coder_session": null,
    "review_request_receipt_id": null,
    "review_response_receipt_id": null,
    "wp_validator_session": null
  },
  "lifecycle": {
    "active": false,
    "blocks": [],
    "depends_on": [
      "MT-046"
    ],
    "status": "PENDING",
    "validator_verdict": "PENDING"
  },
  "markdown_projection": {
    "generated_at_utc": "2026-05-14T08:23:40.507Z",
    "generator": "kernel-builder-activation-repair.mjs",
    "path": ".GOV/task_packets/WP-KERNEL-002-CRDT-Workspace-Write-Box-Preuse-Hardening-v1/MT-047.md",
    "projection_hash": "927d4d8e9b5456e2",
    "source_file": ".GOV/task_packets/WP-KERNEL-002-CRDT-Workspace-Write-Box-Preuse-Hardening-v1/MT-047.json",
    "source_hash": "6694dc8860995a44",
    "status": "GENERATED_IN_SYNC"
  },
  "mt_id": "MT-047",
  "red_team": {
    "minimum_controls": [
      "Exactly one primary proof target per MT unless the packet records why not.",
      "MT identity must be stable and referenced by receipt correlation.",
      "Generated projection drift must not wake Coder or Validator by itself."
    ],
    "profile": "DETERMINISTIC_CONTRACT_MIGRATION_V1",
    "required": true,
    "risks": [
      "Broad MT scope can hide multiple review targets.",
      "Markdown MT lists may disagree with packet-declared active/next MT truth.",
      "Receipt routing may target an old MT if contract identity is omitted."
    ]
  },
  "schema_id": "hsk.microtask_contract@1",
  "schema_version": "microtask_contract_v1",
  "scope": {
    "acceptance_criteria": [
      "MT-047 Markdown Mirror Sync Drift Guard: fold `WP-1-Markdown-Mirror-Sync-Drift-Guard-v1`. Acceptance: deterministic mirror regeneration, drift states, manual advisory handling, reconciliation, DCC mirror queue, and projection banners are implemented."
    ],
    "allowed_paths": [
      "src/backend/handshake_core/src/kernel/**",
      "src/backend/handshake_core/tests/**"
    ],
    "forbidden_paths": [],
    "proof_targets": [
      "cargo test -p handshake_core --target-dir ../Handshake_Artifacts/handshake-cargo-target"
    ],
    "risk_if_missed": "MT-047 scope is lost and Kernel002 can reintroduce drift or direct mutation.",
    "summary": "MT-047 Markdown Mirror Sync Drift Guard: fold `WP-1-Markdown-Mirror-Sync-Drift-Guard-v1`. Acceptance: deterministic mirror regeneration, drift states, manual advisory handling, reconciliation, DCC mirror queue, and projection banners are implemented."
  },
  "updated_at_utc": null,
  "wp_id": "WP-KERNEL-002-CRDT-Workspace-Write-Box-Preuse-Hardening-v1"
}
