{
  "artifact_policy": {
    "allowed_markdown_exceptions": [
      "operator_created_notes",
      "operator_created_research",
      "operator_created_audits",
      "explicit_on_demand_projection",
      "explicit_report_projection_contract",
      "frozen_legacy_migration_reference"
    ],
    "authority_surface": "MACHINE_CONTRACT",
    "legacy_markdown_policy": "SAFETY_NET_ONLY_DO_NOT_COPY_FORWARD",
    "model_created_markdown_authority_allowed": false,
    "operator_facing_authority": false,
    "projection_creation": "ON_DEMAND_OR_CONTRACT_BOUND"
  },
  "authority_files": {
    "microtask_contract": ".GOV/task_packets/WP-KERNEL-003-Sandbox-Validation-Promotion-v1/MT-066.json",
    "microtask_projection": ".GOV/task_packets/WP-KERNEL-003-Sandbox-Validation-Promotion-v1/MT-066.md",
    "packet_contract": ".GOV/task_packets/WP-KERNEL-003-Sandbox-Validation-Promotion-v1/packet.json"
  },
  "contract_authority": "PRIMARY_MACHINE_READABLE",
  "created_at_utc": "2026-05-15T00:40:02.917Z",
  "handoff": {
    "coder_session": null,
    "review_request_receipt_id": null,
    "review_response_receipt_id": null,
    "wp_validator_session": null
  },
  "lifecycle": {
    "active": false,
    "blocks": [],
    "depends_on": [
      "MT-065"
    ],
    "status": "PENDING",
    "validator_verdict": "PENDING"
  },
  "markdown_projection": {
    "generated_at_utc": "2026-05-15T00:58:04.573Z",
    "generator": "kernel-builder-projection-repair.mjs",
    "path": ".GOV/task_packets/WP-KERNEL-003-Sandbox-Validation-Promotion-v1/MT-066.md",
    "projection_hash": "507fe2471daa8716",
    "source_file": ".GOV/task_packets/WP-KERNEL-003-Sandbox-Validation-Promotion-v1/MT-066.json",
    "source_hash": "29caa1f128625454",
    "status": "GENERATED_IN_SYNC"
  },
  "mt_id": "MT-066",
  "red_team": {
    "minimum_controls": [
      "Exactly one primary proof target per MT unless the packet records why not.",
      "MT identity must be stable and referenced by receipt correlation.",
      "Generated projection drift must not wake Coder or Validator by itself."
    ],
    "profile": "DETERMINISTIC_CONTRACT_MIGRATION_V1",
    "required": true,
    "risks": [
      "Broad MT scope can hide multiple review targets.",
      "Markdown MT lists may disagree with packet-declared active/next MT truth.",
      "Receipt routing may target an old MT if contract identity is omitted."
    ]
  },
  "schema_id": "hsk.microtask_contract@1",
  "schema_version": "microtask_contract_v1",
  "scope": {
    "acceptance_criteria": [
      "MT-066 Bootstrap Skeleton Receipt Projection: first skeleton sandbox run creates restartable receipts. Acceptance: all receipts visible after restart."
    ],
    "allowed_paths": [
      "src/backend/handshake_core/src/kernel/**",
      "src/backend/handshake_core/tests/**"
    ],
    "forbidden_paths": [],
    "proof_targets": [
      "cargo test -p handshake_core kernel_sandbox_skeleton --target-dir ../Handshake_Artifacts/handshake-cargo-target"
    ],
    "risk_if_missed": "integration path is unproven.",
    "summary": "MT-066 Bootstrap Skeleton Receipt Projection: first skeleton sandbox run creates restartable receipts. Acceptance: all receipts visible after restart."
  },
  "updated_at_utc": null,
  "wp_id": "WP-KERNEL-003-Sandbox-Validation-Promotion-v1"
}
